{
  "tipo_artefato": "diario_aee",
  "origem": {
    "nome_arquivo": "Diario_de_Classe_AEE_2025_10_Estudantes_Ficticios_Escola_Professor_Ficticios.bench_anonimizado.txt",
    "formato_original": "txt",
    "pagina_ou_aba": null
  },
  "conteudo_pedagogico": {
    "objetivo_pedagogico": null,
    "barreiras_identificadas": [],
    "estrategias_pedagogicas": [],
    "recursos_acessibilidade": [],
    "observacoes_relevantes": null
  },
  "anonimizacao": {
    "aplicada": true,
    "itens_mascarados": [
      "private_person",
      "private_phone"
    ],
    "risco_reidentificacao": "nao_avaliado"
  },
  "metadados_processamento": {
    "pipeline_versao": "apda-local-0.2-opf",
    "data_processamento": "2026-04-30T11:26:47.840264",
    "status": "pendente_revisao",
    "confianca_extracao": "nao_calculada"
  },
  "validacao_humana": {
    "necessaria": true,
    "status": "pendente",
    "responsavel": null
  }
}