{
  "tipo_artefato": "plano_atendimento",
  "origem": {
    "nome_arquivo": "Diario_de_Classe_AEE_2025_10_Estudantes_Ficticios_Escola_Professor_Ficticios.texto_extraido.txt",
    "formato_original": "txt",
    "pagina_ou_aba": "ABA: Aluno 1",
    "segmento_indice": 1,
    "segmento_total": 2
  },
  "conteudo_pedagogico": {
    "objetivo_pedagogico": null,
    "barreiras_identificadas": [],
    "estrategias_pedagogicas": [],
    "recursos_acessibilidade": [],
    "observacoes_relevantes": null
  },
  "anonimizacao": {
    "aplicada": true,
    "itens_mascarados": [
      "private_person"
    ],
    "risco_reidentificacao": "nao_avaliado"
  },
  "metadados_processamento": {
    "pipeline_versao": "apda-local-0.3-segmented",
    "data_processamento": "2026-04-30T11:06:05.595167",
    "status": "pendente_revisao",
    "confianca_extracao": "nao_calculada"
  },
  "validacao_humana": {
    "necessaria": true,
    "status": "pendente",
    "responsavel": null
  }
}